{
  "episodeId": "abs-2026-000123",
  "pseudonymId": "owhs:pseudo:a1b2c3d4e5f60718",
  "reasonCode": "musculoskeletal",
  "startDate": "2026-03-02",
  "endDate": "2026-03-16",
  "workingDaysLost": 10,
  "workingHoursLost": 75,
  "fitNoteFlag": true,
  "workRelatedFlag": false,
  "sourceProvenance": {
    "sourceType": "hris",
    "sourceProvider": "BrightHR",
    "sourceId": "BR-99812"
  },
  "ext": {
    "owhs-example": {
      "wave": 3
    }
  }
}
